{
  "felles": {
    "søkerNavn": "Dolly Duck",
    "søkerPersonnummer": "300220 12345",
    "brevDato": "4. mai 2021",
    "erAutomatiskBehandlet": false,
    "saksnummer": "123456789",
    "ytelseType": "FP",
    "erUtkast": false
  },
  "gjelderTilbakekreving": false,
  "lovhjemler": "folketrygdloven § 21-12 og forvaltningsloven §§ 28, 31, 32 og 34",
  "klagefristUker": 6,
  "avvistGrunner": [
    "KLAGE_UGYLDIG"
  ],
  "påklagdVedtak": true
}
